{
  "$schema": "https://json-schema.org/draft/2020-12/schema",
  "title": "MTS Trade Plan",
  "description": "One trade idea for the Deribit execution layer (T050). Compiled by plan_compiler.py into an order list, executed by executor.py. Defaults below are conservative starting caps per T050 dependency list; operator raises them after phase 4 (reconciliation) proves stable, not before.",
  "type": "object",
  "required": ["plan_id", "account", "instrument", "side", "validity", "entry", "base_unit", "stop", "caps"],
  "additionalProperties": false,
  "properties": {
    "plan_id": {
      "type": "string",
      "pattern": "^[a-zA-Z0-9_-]+$",
      "description": "Unique identifier, e.g. plan_20260927_001"
    },
    "account": {
      "type": "string",
      "description": "Deribit subaccount name/label this plan trades on. Single-account only in phase 1-5; multi-account is step 6."
    },
    "instrument": {
      "type": "string",
      "enum": ["BTC-PERPETUAL"],
      "description": "Phase 1 scope is BTC-PERPETUAL only. Widening this enum is a deliberate later decision, not a default."
    },
    "side": {
      "type": "string",
      "enum": ["LONG", "SHORT"]
    },
    "max_hold_minutes": {
      "type": "number",
      "exclusiveMinimum": 0,
      "description": "Optional time exit: position_manager closes the position (reduce-only market, close first, then cancels stop/targets) once this many minutes have elapsed since the entry fill."
    },
    "validity": {
      "type": "object",
      "required": ["start", "end"],
      "additionalProperties": false,
      "properties": {
        "start": {"type": "string", "format": "date-time", "description": "ISO-8601 UTC, e.g. 2026-09-27T10:00:00Z"},
        "end": {"type": "string", "format": "date-time", "description": "ISO-8601 UTC. Plan expires (not executed / entry cancelled) after this."}
      }
    },
    "entry": {
      "type": "object",
      "required": ["type"],
      "properties": {
        "type": {"type": "string", "enum": ["market", "limit", "ladder"]},
        "price": {
          "type": "number",
          "exclusiveMinimum": 0,
          "description": "Required when type=limit. Ignored for market. Not used for ladder (use range)."
        },
        "range": {
          "type": "object",
          "required": ["low", "high"],
          "properties": {
            "low": {"type": "number", "exclusiveMinimum": 0},
            "high": {"type": "number", "exclusiveMinimum": 0}
          },
          "description": "Required when type=ladder. low < high; rungs are distributed across this range."
        },
        "rungs": {
          "type": "integer",
          "minimum": 1,
          "maximum": 10,
          "description": "Required when type=ladder. Max 10 pending Opus confirmation (T050 dependency: ladder size cap not yet set)."
        },
        "size_multipliers": {
          "type": "array",
          "items": {"type": "number", "exclusiveMinimum": 0},
          "minItems": 1,
          "maxItems": 10,
          "description": "Required when type=ladder. Length must equal rungs. Each multiplier scales base_unit for that rung."
        }
      },
      "allOf": [
        {
          "if": {"properties": {"type": {"const": "limit"}}},
          "then": {"required": ["price"]}
        },
        {
          "if": {"properties": {"type": {"const": "ladder"}}},
          "then": {"required": ["range", "rungs", "size_multipliers"]}
        }
      ]
    },
    "base_unit": {
      "type": "number",
      "exclusiveMinimum": 0,
      "description": "Base contract size (USD-denominated, BTC-PERPETUAL is inverse). Rounded to $10 increments by the compiler."
    },
    "stop": {
      "type": "object",
      "required": ["type"],
      "properties": {
        "type": {"type": "string", "enum": ["fixed_percent", "trailing_percent", "breakeven_after_fills"]},
        "percent_below_entry": {
          "type": "number",
          "exclusiveMinimum": 0,
          "maximum": 50,
          "description": "Required when type=fixed_percent or trailing_percent."
        },
        "min_fills_for_breakeven": {
          "type": "integer",
          "minimum": 1,
          "description": "Required when type=breakeven_after_fills. Stop moves to average entry once this many rungs have filled."
        }
      },
      "allOf": [
        {
          "if": {"properties": {"type": {"enum": ["fixed_percent", "trailing_percent"]}}},
          "then": {"required": ["percent_below_entry"]}
        },
        {
          "if": {"properties": {"type": {"const": "breakeven_after_fills"}}},
          "then": {"required": ["min_fills_for_breakeven"]}
        }
      ]
    },
    "targets": {
      "type": "array",
      "items": {
        "type": "object",
        "required": ["amount_percent", "pnl_target_percent"],
        "additionalProperties": false,
        "properties": {
          "amount_percent": {"type": "number", "exclusiveMinimum": 0, "maximum": 100},
          "pnl_target_percent": {"type": "number", "exclusiveMinimum": 0}
        }
      },
      "description": "Optional. Sum of amount_percent across all targets must not exceed 100 (validator-enforced, not schema-enforced - JSON Schema can't sum across array items)."
    },
    "caps": {
      "type": "object",
      "required": ["max_notional_usd", "max_loss_usd", "max_concurrent_orders"],
      "additionalProperties": false,
      "properties": {
        "max_notional_usd": {
          "type": "number",
          "exclusiveMinimum": 0,
          "maximum": 10000,
          "description": "Hard ceiling on this plan's total notional. Schema max of $10,000 is the conservative T050 default; operator raises after phase 4 proves stable."
        },
        "max_loss_usd": {
          "type": "number",
          "exclusiveMaximum": 0,
          "minimum": -500,
          "description": "Hard ceiling on this plan's worst-case realized loss (negative number). Schema floor of -$500 is the conservative T050 default."
        },
        "max_concurrent_orders": {
          "type": "integer",
          "minimum": 1,
          "maximum": 10,
          "description": "Entry rungs + stop + targets combined must not exceed this. Conservative default cap is 10."
        }
      }
    },
    "signal_ref": {
      "type": "string",
      "description": "Optional. Free-text reference to the MTS rule/condition that produced this plan, e.g. 'T040-tick-delta' or 'manual-operator'. Decoupled from signal source by design - trade-plan validity does not depend on this field."
    }
  }
}
