{
  "plan_id": "valid_no_targets_just_stop",
  "account": "subaccount_2",
  "instrument": "BTC-PERPETUAL",
  "side": "SHORT",
  "validity": {"start": "2026-09-27T14:00:00Z", "end": "2026-09-27T18:00:00Z"},
  "entry": {"type": "market"},
  "base_unit": 200,
  "stop": {"type": "fixed_percent", "percent_below_entry": 1.0},
  "caps": {"max_notional_usd": 8000, "max_loss_usd": -400, "max_concurrent_orders": 2},
  "signal_ref": "manual-operator"
}
